{"schema":1,"id":"valid-action-drawer-menu","name":"Demo","version":"1.0.0","actions":[{"id":"go","label":"Go","run":"bin/run.sh","output":"show"},{"id":"wipe","label":"Wipe","run":"bin/run.sh","output":"show","menu":true,"confirm":"Wipe everything?"},{"id":"quiet","label":"Quiet","run":"bin/run.sh","output":"show","menu":false}]}
